{
  "$schema": "http://json-schema.org/draft-07/schema#",
  "$id": "https://openitinerary.org/schema/v0.1/itinerary.schema.json",
  "title": "Open Itinerary",
  "description": "An agent-optimized, app-consumable format for travel itineraries and road trips.",
  "type": "object",
  "required": ["$schema", "version", "title", "stops"],
  "additionalProperties": false,

  "properties": {
    "$schema": {
      "type": "string",
      "description": "Must point to the Open Itinerary schema URI.",
      "const": "https://openitinerary.org/schema/v0.1/itinerary.schema.json"
    },

    "version": {
      "type": "string",
      "description": "Schema version this document conforms to.",
      "const": "0.1"
    },

    "title": {
      "type": "string",
      "description": "Short human-readable name for the itinerary.",
      "examples": ["Pacific Coast Highway Road Trip", "48 Hours in Tokyo"]
    },

    "summary": {
      "type": "string",
      "description": "A one-to-three sentence overview of the itinerary, suitable for display as a description or agent handoff context."
    },

    "tags": {
      "type": "array",
      "description": "Free-form labels for filtering and discovery.",
      "items": { "type": "string" },
      "examples": [["road-trip", "coastal", "family-friendly"]]
    },

    "duration_days": {
      "type": "integer",
      "minimum": 1,
      "description": "Suggested total trip length in days. Informational; does not constrain stop count."
    },

    "travel_modes": {
      "type": "array",
      "description": "All travel modes used across this itinerary.",
      "items": {
        "type": "string",
        "enum": [
          "driving",
          "flying",
          "walking",
          "cycling",
          "transit",
          "ferry",
          "mixed"
        ]
      }
    },

    "stops": {
      "type": "array",
      "description": "Ordered list of stops. Sequence implies suggested visit order, not a strict schedule.",
      "minItems": 1,
      "items": { "$ref": "#/$defs/Stop" }
    },

    "generated_by": {
      "type": "string",
      "description": "Optional. Name or identifier of the agent or app that produced this itinerary.",
      "examples": ["claude-sonnet-4", "MyTravelApp/2.0"]
    },

    "created_at": {
      "type": "string",
      "format": "date-time",
      "description": "ISO 8601 timestamp of when this itinerary was generated."
    }
  },

  "$defs": {
    "Location": {
      "type": "object",
      "required": ["name"],
      "additionalProperties": false,
      "description": "A named place. `name` (and optionally `address`) is the source of truth. `coords` is a derived cache populated by the geocoder — never set by hand, never trusted over the name.",
      "properties": {
        "name": {
          "type": "string",
          "description": "Display name of the location. This is the authoritative identifier — what a human would search for.",
          "examples": ["Big Sur, California", "Tsukiji Outer Market, Tokyo"]
        },
        "address": {
          "type": "string",
          "description": "Optional street address or locality. Used as a geocoding hint when present."
        },
        "place_id": {
          "type": "string",
          "description": "Optional external place identifier. Prefix with source namespace: 'gplaces:ChIJ...' or 'osm:node/12345'."
        },
        "coords": {
          "$ref": "#/$defs/Coords"
        }
      }
    },

    "Coords": {
      "type": "object",
      "required": ["lat", "lng", "source"],
      "additionalProperties": false,
      "description": "Geocoded coordinates. Always produced by a geocoder, never authored by hand or by an AI agent. Treat as a cache: discard and re-geocode if `name` or `address` changes.",
      "properties": {
        "lat": {
          "type": "number",
          "minimum": -90,
          "maximum": 90,
          "description": "Latitude in decimal degrees (WGS84)."
        },
        "lng": {
          "type": "number",
          "minimum": -180,
          "maximum": 180,
          "description": "Longitude in decimal degrees (WGS84)."
        },
        "source": {
          "type": "string",
          "description": "Geocoding provider that produced these coordinates.",
          "enum": ["nominatim", "photon", "google", "mapbox", "here", "manual"]
        },
        "geocoded_at": {
          "type": "string",
          "format": "date-time",
          "description": "ISO 8601 timestamp of when geocoding was performed. Useful for cache invalidation."
        }
      }
    },

    "Duration": {
      "type": "object",
      "additionalProperties": false,
      "description": "A suggested time range to spend at a stop. Both fields are optional; omit if truly unknown.",
      "properties": {
        "min_hours": {
          "type": "number",
          "minimum": 0,
          "description": "Minimum suggested hours at this stop."
        },
        "max_hours": {
          "type": "number",
          "minimum": 0,
          "description": "Maximum suggested hours at this stop."
        },
        "note": {
          "type": "string",
          "description": "Free-text clarification, e.g. 'allow longer if hiking'.",
          "examples": [
            "allow longer if you plan to hike",
            "lunch rush can add 30 min"
          ]
        }
      }
    },

    "Stop": {
      "type": "object",
      "required": ["id", "location", "goal"],
      "additionalProperties": false,
      "description": "A single point of interest or waypoint in the itinerary.",
      "properties": {
        "id": {
          "type": "string",
          "description": "Unique identifier for this stop within the itinerary. Stable across edits; used for references.",
          "examples": ["stop-1", "overnight-sf"]
        },

        "location": { "$ref": "#/$defs/Location" },

        "goal": {
          "type": "string",
          "description": "Short phrase describing the purpose or intent of this stop. The 'why' behind visiting.",
          "examples": [
            "Grab lunch at a seafood shack",
            "Overnight stay",
            "Scenic viewpoint — stretch and take photos",
            "Fuel up and restock snacks"
          ]
        },

        "category": {
          "type": "string",
          "description": "Broad category for filtering and iconography.",
          "enum": [
            "accommodation",
            "food",
            "drink",
            "attraction",
            "nature",
            "transport",
            "rest",
            "shopping",
            "activity",
            "viewpoint",
            "other"
          ]
        },

        "duration": { "$ref": "#/$defs/Duration" },

        "notes": {
          "type": "string",
          "description": "Additional context, tips, or caveats for this stop. Markdown is supported."
        },

        "day": {
          "type": "integer",
          "minimum": 1,
          "description": "Optional suggested day number (1-indexed). Use when grouping stops by day matters but exact times do not."
        },

        "alternatives": {
          "type": "array",
          "description": "Other options the traveler could choose instead of or in addition to this stop (e.g. nearby restaurants, alternate hotels).",
          "items": { "$ref": "#/$defs/Alternative" }
        }
      }
    },

    "Alternative": {
      "type": "object",
      "required": ["location", "goal"],
      "additionalProperties": false,
      "description": "A suggested alternative or supplement to a stop. Lighter than a full Stop — no id or nested alternatives.",
      "properties": {
        "location": { "$ref": "#/$defs/Location" },
        "goal": {
          "type": "string",
          "description": "Why you'd choose this alternative.",
          "examples": [
            "Budget-friendly option",
            "Better for vegetarians",
            "Closer to the highway"
          ]
        },
        "category": {
          "type": "string",
          "enum": [
            "accommodation",
            "food",
            "drink",
            "attraction",
            "nature",
            "transport",
            "rest",
            "shopping",
            "activity",
            "viewpoint",
            "other"
          ]
        },
        "duration": { "$ref": "#/$defs/Duration" },
        "notes": {
          "type": "string",
          "description": "Additional context for this alternative."
        }
      }
    }
  }
}
